,headline,article_text,source,bias,cleaned_text,compound,positive,neutral,negative
51,Local court grants police three-day custody of four accused in Lakhimpur Kheri violence case,"LAKHIMPUR KHERI: A local court on Thursday granted police three-day custody of the four accused in the October 3 violence here in which eight people, including four farmers, were killed. The court sent Sumit Jaiswal, Satya Prakash Tripathi alias Satyam, Nandan Singh Bishta and Shishu Pal to police remand.  The accused were arrested in connection with the violence in Tikonia area and produced before the remand magistrate on October 19 that sent them to 14 days' judicial custody. The investigators had moved an application on the same day, requesting the court for their police custody remand (PCR). The PCR application was heard on Thursday. Senior Prosecution Officer (SPO) SP Yadav said, ""The court of Chief Judicial Magistrate Chinta Ram heard the prosecution and the defense on the application for police custody remand of the four accused."" Yadav said that the court then accepted three days' police custody remand of the accused from October 22 to October 25. The investigators have moved a fresh application for three days' police custody remand of Union Minister of State for Home Ajay Mishra's son Ashish Mishra alias Monu, Ankit Das, Latif and Shekhar Bharti for further interrogation, he said. The SPO said that the hearing on the fresh police custody remand application for Ashish Mishra and three others has been scheduled for Friday. So far, besides the minister's son, 10 people have been arrested in this case. An FIR was lodged at the Tikonia Police Station on October 3 over the episode in which Ashish Mishra was named as accused besides 15 to 20 unnamed people. The next day, a counter-FIR was lodged at the same police station on the basis of a complaint by Sumit Jaiswal, who has now been arrested. An SIT constituted by the state police is probing the case.",newsexp,R,,,,,
52,"Lakhimpur violence: Only 4 out of 44 witnesses recorded, SC asks UP govt to take all statements","NEW DELHI:  Hauling up the UP Police for not recording statements of vulnerable witnesses in the Lakhimpur Kheri violence, the Supreme Court on Wednesday pulled it up for dilly-dallying and delaying the filing of the status report in the probe. Eight persons, including four farmers, were killed in the violence on October 3. “We think you are dragging your feet. Please dispel that impression,” observed a bench led by Chief Justice of India N V Ramana. The remarks came while perusing the UP government’s status report that was filed in a sealed cover just before the hearing. “We had expected it (report) yesterday and waited for it till late night,” the CJI told UP’s counsel, adding they hadn’t instructed filing it in a sealed cover.  ALSO READ | Lakhimpur Kheri violence: 'Rail roko' affects 150 locations in Northern Railway zone, 60 trains affected In the past, the court had faced criticism for the sealed cover procedure in sensitive cases like the Rafale scam.  During the hearing, the bench asked as to why the police had recorded statements of only four out of 44 witnesses under Section 164 of the CrPC. “This statement (164 CrPC) has more evidentiary value; why haven’t you recorded them? Statement before police will not lead anywhere,” Justice Suryakant said. Senior advocate Harish Salve, who also represented UP, claimed the probe into the killing of farmers was still on and the process to record statements is ongoing. He said the police had recorded two FIRs — one related to the murder case allegedly involving the son of a Union minister after SUVs ploughed into farmers in the village, and the other in which the crowd lynched and killed those who were in the cars. ALSO READ: SIT releases photos of six suspects Salve said 10 people have been arrested in connection with the farmers’ killing, of which four are still in police custody. Saying it was only concerned with the attack on farmers, the bench asked whether the accused were taken into police custody. The counsel said prior to being sent to jail, the six accused were in police custody for three days. The bench then asked if the police themselves gave up the right to seek their police custody or the local court denied them custody. Witness protection
The bench told Salve to protect vulnerable witnesses. “You are in a better position to ascertain who needs protection. Record their statements and give them protection.” Salve said he will make sure the UP govt draws up a witness protection plan and will share the details on October 26, the next date of hearing",newsexp,R,,,,,
53,Lakhimpur Kheri case: SIT releases 6 photos of lynching suspects announce ‘rewards’ for info,"LUCKNOW: While probing into the mowing down of four farmers in the Lahikmpur Kheri violence case, the special investigation team (SIT) of UP Polie released six photographs of suspects who had allegedly ‘lynched’ three BJP workers after the farmers’ death on October 3.  It has also announced cash rewards -- without mentioning the amount --for information about the suspects and assured that the identity of the informers will be protected.  The pictures released by the SIT show a few men with sticks and black flags in their hands near burning vehicles. The SIT said sharing the pictures may amount to violation of rights and something that may put these men at risk.  As per the highly placed sources, police are trying to ascertain the nature of the attack on the convoy led by MoS Ajay Mishra’s son Ashish Mishra. Primarily, the SIT wants to establish if the attack on the convoy was ‘intentional or an act of retaliation. SN Sabat, additional director general (Lucknow zone), however, said, “It is a legal process which we normally follow in all other cases as well.” As per the sources, among the photos, while some faces are local, others may be from adjoining districts including Pilibhit and Bahraich, etc. The sources also claimed that the photos were taken out from the video clips which the SIT got from various sources. “Both the FIRs are under scanner. After the release of photos, witnesses have started arriving at the crime branch office to record their statements. Around five witnesses recorded their statements on Wednesday,” said Upendra Agarwal, DIG heading the SIT.",newsexp,R,,,,,
54,Supreme Court to hear Lakhimpur Kheri matter on October 20,"NEW DELHI: The Supreme Court is scheduled to hear on Wednesday the matter pertaining to the October 3 violence in Lakhimpur Kheri in which eight persons, including four farmers, were killed during a farmers' protest. A bench comprising Chief Justice N V Ramana and Justices Surya Kant and Hima Kohli, which had on October 8 expressed dissatisfaction over the steps taken by the Uttar Pradesh government in the ""brutal"" murder of eight persons, would hear the matter.  Ten people, including Union Minister of State for Home Ajay Mishra's son Ashish Mishra, have been arrested so far in connection with the case. The top court is hearing the matter after two lawyers had written a letter to the CJI seeking a high-level judicial inquiry, also involving the CBI, into the incident. Four farmers were mowed down by an SUV in Lakhimpur Kheri when a group agitating against the Centre's three new farm laws was holding a demonstration against the visit of Uttar Pradesh Deputy Chief Minister Keshav Prasad Maurya on October 3. Two BJP workers and a driver were beaten to death allegedly by the angry protesters, while a local journalist was also killed in the violence. Several farmer organisations are protesting against the passage of three laws -- The Farmers Produce Trade and Commerce (Promotion and Facilitation) Act, 2020, The Essential Commodities (Amendment) Act, 2020 and Farmers (Empowerment and Protection) Agreement on Price Assurance and Farm Services Act, 2020 since last November. The apex court had stayed the implementation of these laws in January. Initially, the protests started from Punjab in November last year and later spread to Delhi, Haryana, and Uttar Pradesh While hearing the matter on October 8, the apex court had questioned the Uttar Pradesh government over the non-arrest of all the accused and had directed preservation of evidence. The bench had said, ""the law must take its course against all accused"" and ""the government has to take all remedial steps in this regard to inspire confidence"" in the investigation of ""brutal murder of eight persons"". The counsel appearing for the state government had assured the top court on October 8 that all appropriate action would be taken in the case.",newsexp,R,,,,,
55,"Lakhimpur, a question of human dignity","A local court in Lakhimpur in Uttar Pradesh has rejected the bail plea of Ashish Mishra, son of Union Minister Ajay Mishra, in the case over the murder of four farmers and a journalist. A few have been arrested in connection with the incident. The allegation is that the farmers and the journalist were killed by a convoy that deliberately ran over them and the accused had caused it. The video of the scene has shocked our mass conscience. The fact that a few BJP workers too were killed is quite sad and perturbing. After the incident, the UP Law Minister Brajesh Pathak visited the families of the BJP workers, while not caring to meet the families of the farmers who lost their lives. An elected government and the ministers running it must act in terms of the Constitution and not merely based on their political beliefs or inclinations. Such an ethical metamorphosis is an imperative, given the letter and spirit of the oath that a minister takes as per the Constitution. Jawaharlal Nehru, on the eve of Independence, opined that after the country attains freedom, though there would be a Congress government, it won’t be controlled by leaders of the Congress Party. This distinction should apply to every dispensation, irrespective of its political colour.  However, during the time of democratic crisis, this fine division becomes blurred, and the very government gets identified with the political party. Worse, even the political parties get reduced to an individual and the individual is glorified and equalised with the nation. Recall the slogan “India is Indira; Indira is India” formulated by D K Barooah, the Congress leader, prior to the Emergency (1975–77). At present, political idolatry is re-emerging in the country. It leads to a situation where Cabinet ministers act merely as political leaders with partisan interest, as it occurred with the UP law minister. This is an indication of democratic degeneration. Tarunabh Khaitan of Oxford University says that right from 2014, the Central government “consistently sought to erase the distinction between the party and the state by incrementally, but systemically, seeking to undermine or capture mechanisms that seek executive accountability”. A reflection of the process is also discernible in states like UP, Assam and Gujarat. A significant impact of this democratic destabilisation is clearly manifested in the uprooting of rule of law in such states. The Lakhimpur incident narrates a changed idea of law enforcement that negates the tenets of constitutionalism. It tells us about much more than mere criminalisation of politics. It was in the Manoj Narula case (2014) that the Supreme Court said that “criminalisation of politics is an anathema to the sacredness of democracy”. In the judgment, the court emphasised the significance of constitutional morality and good governance. The court said: “The faith of the people is embedded in the root of the idea of good governance which means reverence for citizenry rights, respect for fundamental rights and statutory rights in any governmental action, deference for unwritten constitutional values, veneration for institutional integrity, and inculcation of accountability to the collective at large.” The Lakhimpur episode, along with several other incidents ranging from Unnao to Hathras, not only shows the increasing crime rate in UP, but also the regime’s attitude towards it. According to a report by the National Crime Records Bureau, UP has recorded the highest number of murder cases in India (3,779) in 2020. Process of law often takes a back seat. It required the admonition of the top court even for arresting the accused in the Lakhimpur incident. It is in the very same state that journalists are arrested and incarcerated for doing their job, by invoking draconian laws like the Unlawful Activities (Prevention) Act. Those who protested the Citizenship Amendment Act and the farm laws too had to face a similar predicament. False encounter killings and vigilantism has become the new normal. Almost every gathering of people with an agitational gesture was labelled unlawful, with Section 144 of the Criminal Procedure Code invoked. Activist Harsh Mander has pointed out that out of 139 persons jailed in 2020 under the National Security Act, 76 were accused of cow slaughter. Alleging ‘love jihad’, many couples were arrested. The state that instigated or abetted or justified heinous crimes like murder and rape was keen to brand personal intimacy a serious offence. Selective use or misuse or non-use of law, in accordance with the temporal requirement of those in power, is the new UP brand of justice. States like Assam and Tripura followed suit. Recall the killing of two people in police firing in Darrang district in Assam. The video of the official photographer thrashing the corpse of a man points to the situation in our troubled times. There is no human dignity without true democracy. As jurist Ronald Dworkin opined, “equal concern and respect” are the hallmarks of rule of law. Liberty, equality and fraternity are non-negotiable facets of egalitarianism. In constitutional democracies, rule of law rejects arbitrariness of power, as classically explained by the jurist A V Dicey. The law should be always above the politics of the day. However, in the UP model, the law is only an instrument of political power. Lakhimpur speaks volumes about the failure of a legal system, and of politics along with it. Kaleeswaram Raj
Lawyer, Supreme Court of India
(kaleeswaramraj@gmail.com)
(Tweets @KaleeswaramR)
 ",newsexp,R,,,,,
56,"Lakhimpur Kheri violence: Accused Sumit Jaiswal, 3 others arrested","LUCKNOW: In the latest development, Lakhimpur Kheri Police and the SWAT team of the crime branch on Monday arrested four more persons including Sumit Jaiswal alias Modi in connection with the violence that claimed eight lives on October 3. The other three persons arrested in connection with the case are Shishupal, Nandan Singh Bisht, and Satya Prakash Tripathi. With the arrest of four more persons, the total number of persons arrested so far in connection with the case rises to 10.  At the time of arrest, the SWAT team recovered and seized a licensed revolver and three bullets from the possession of Satya Prakash Tripathi, said the police sources. The police had been looking for Sumit Jaiswal who was seen in one of the videos fleeing the Thar Mahindra SUV that allegedly had mowed down the protesting farmers. Jaiswal had got the cross FIR lodged against the farmers for the lynching of three persons. Meanwhile, Ashish Mishra and his co-accused Ankit Das, Latif aka Kale, and Das’s driver Shekhar Bharti have been sent to Lakhimpur district jail after the completion of their respective police remand. All the accused have been kept in separate cells in the jail. The sources claimed that the SIT probing into the violence has got around 135 video clips from different sources so far. Moreover, photos and CCTV footage have also been received by the SIT which is investigating all the angles by joining the series of events that led to violence.  On the other, MoS Ajay Mishra Teni held the local police responsible for the incident. He said while visiting one of the families of the victim BJP workers that it was the laxity on the part of the district administration that led to such an incident. The minister claimed that a CBI probe would be undertaken keeping the DM, SP, and other officials under scanner in the case.",newsexp,R,,,,,
57,"Lakhimpur Kheri violence: Stray protests, no major impact of 'Rail Roko' in Uttar Pradesh","LUCKNOW: Barring stray protests at railway tracks at some places, the Samyukt Kisan Morcha's six-hour 'Rail Roko' stir over Lakhimpur Kheri violence failed to create any significant impact in Uttar Pradesh on Monday. The farmers protested briefly at some places of the state.  There was heavy police deployment in and around railway stations, but trains stopped briefly at few stations, railway officials said. Trains were halted at Meerut and Greater Noida's Dankaur stations by the protesters, BKU media in-charge Dharmendra Malik said. In Ghaziabad's Modinagar, they agitated in front of a goods train which had already reached its destination. In Uttar Pradesh's Muzaffarnagar, Bharatiya Kisan Union (BKU) workers halted the Amritsar-Delhi and the Jalandhar Express trains by staging a dharna on rail tracks. The BKU workers also staged a token demonstration at the Raya Station in Mathura, officials said, adding that they later vacated the railway tracks. Meanwhile, peace prevailed in Lakhimpur Kheri, the site of the October 3 violence. ALSO READ: 'Rail roko' affects 150 locations in Northern Railway zone, 60 trains affected The railways had suspended train movement in the region, with the Samyukt Kisan Morcha (SKM) also withdrawing its agitation there. Amandeep Singh Sandhu, BKU district president, told PTI that in ""view of the prevailing situation in Kheri, the SKM had cancelled the 'rail roko' agitation in the district"". ""Also, the untimely rains and heavy winds had hit the paddy crops in the district and farmers are busy managing the crop… the railways has also suspended the movement of trains in Kheri, hence, it (agitation) was of no use there,"" he said. The farmers' body had given the call for nationwide ‘rail roko andolan' to demand the dismissal and arrest of Minister of State for Home Ajay Mishra to ensure justice in the Lakhimpur Kheri case. Ashish Mishra, son of Ajay Mishra, was arrested in connection with the case on October 9. Shivam Sharma, PRO, North Central Railway (NCR) said farmers stopped the Gomti Express for two to three minutes at the Khurja Railway Station. The protesters, however, left after being persuaded by the police. In Jhansi, the farmers demonstrated for around 10 minutes at the Dabra Station and between Gohad and Malanpur stations. They later left after being asked by the police, he said. Similarly at two places between Mathura-Palwal of Agra Division, the farmers demonstrated at the railway gate and also near the Rundhi Station. ALSO READ: Not received any report of disturbance, say Delhi Police on Farmers' 'rail roko' stir Sharma said there was no loss of railway property. ""In Lucknow, police were deployed in large numbers at Utrathia and Alamnagar railway stations. The security personnel prevented the farmers from entering the stations,"" Lucknow Police Commissioner D K Thakur said. He said elaborate security arrangements have been made outside all railway stations of the state capital, and farmers were stopped before reaching the stations. Kanpur Police Commissioner Aseem Arun said there was no impact of the farmers' agitation in Kanpur as tight security arrangements were maintained as a precautionary measure. The SKM, leading the movement against the Centre's new agricultural laws, had in a statement said that the agitation of the farmers would be intensified till there was justice in the Lakhimpur Kheri case. It had also said that trains would be stopped from 10 am to 4 pm on Monday during the 'Rail Roko' protest. ""A nationwide rail roko andolan to demand the dismissal and arrest of Minister of State for Home Ajay Mishra to ensure justice in the Lakhimpur Kheri case will be held on October 18,"" it had said. Eight people, including four farmers, died in the violence on October 3. The four farmers were allegedly knocked down by a vehicle carrying BJP workers. Angry farmers then allegedly lynched some people in the vehicles. The other dead included two BJP workers and their driver. Farmers have claimed that Ashish Mishra was in one of the vehicles, an allegation denied by him and Ajay Mishra, who say they can produce evidence to prove he was at an event at that time.",newsexp,R,,,,,
58,"Lakhimpur Kheri violence: 'Rail roko' affects 150 locations in Northern Railway zone, 60 trains affected","NEW DELHI: The Samyukt Kisan Morcha's six-hour 'rail roko' protest on Monday over the Lakhimpur violence affected 150 locations in the Northern Railway zone and hindered the running of 60 trains, said its chief public relation officer (CPRO). In the North Western Railway (NWR) zone, rail traffic was affected in some sections in Rajasthan and Haryana with 18 trains cancelled, 10 partially cancelled and one diverted due to the protest.  The trains that have been affected in the Northern Railway zone include the Chandigarh-Ferozepur Express. Its scheduled departure from Ludhiana was 7 am, but has been stranded there due to a blockade in the Ferozpur-Ludhiana section, the official said. The New Delhi-Amritsar Shatabdi Express was halted near Shambu station as protesters blocked railway tracks near Sahnewal and Rajpura. ""So far, 130 locations in the Northern Railway zone have been affected and operations of 50 trains hindered,"" the Northern Railway CPRO said. In Rajasthan, the agitation affected train movement in Hanumangarh and Sriganganagar of the Bikaner division. ALSO READ | Lakhimpur Kheri violence: Cong slams PM Modi for not removing Union minister despite son's arrest An NWR spokesperson said rail traffic on Bhiwani-Rewari, Sirsa-Rewari, Loharu-Hisar, Suratgarh-Bathinda, Sirsa-Bathinda, Hanumangarh-Bathinda, Rohtak-Bhiwani, Rewari-Sadulpur, Hisar-Bathinda, Hanumangarh-Sadulpur and Sri Ganganagar-Rewari sections was affected due to the agitation. The Bathinda-Rewari Special train and the Sirsa-Ludhiana Special train will remain cancelled on Monday, he said, adding the route of Ahmedabad-Shri Mata Vaishno Devi Katra Special train has also been changed. The train which departed from Ahmedabad on Saturday will run on the changed route via Rewari-Delhi-Pathankot to Shri Mata Vaishno Devi Katra, he said. The Samyukt Kisan Morcha, an umbrella body of farmer unions spearheading the agitation against the Centre's three agri laws, had said ""protests will be intensified until justice is secured"" in the Lakhimpur Kheri case. All train traffic will be stopped from 10 am till 4 pm on Monday during the 'rail roko' protest over the demand of the dismissal and arrest of Union Minister Ajay Mishra in connection with the Lakhimpur Kheri case, the SKM had said. Four of the eight people who died in the violence in Uttar Pradesh's Lakhimpur Kheri on October 3 were farmers, allegedly knocked down by a vehicle carrying BJP workers. Angry farmers then allegedly lynched some people in the vehicles. The other dead included two BJP workers and their driver. Farmers have claimed that Ashish Mishra was in one of the vehicles, an allegation denied by him and Ajay Mishra who say they can produce evidence to prove he was at an event at that time. Ashish Mishra was arrested in the case on October 9.",newsexp,R,,,,,
59,"'Rail Roko' protest: Farmers block train traffic in Punjab, demand justice in Lakhimpur violence case","CHANDIGARH: Farmers in Punjab squatted on rail tracks on Monday morning as part of the Samyukt Kisan Morcha's six-hour 'rail roko' protest demanding the dismissal and arrest of Union Minister Ajay Mishra in connection with the violence in Uttar Pradesh's Lakhimpur Kheri. A railway official said four sections of the Ferozepur division were blocked by the protesters.  The Ferozepur-Fazilka section in Ferozepur city and the Ferozepur-Ludhiana section at Ajitwal in Moga were affected, the official said. ​ALSO READ | Lakhimpur incident: SKM to hold 'Rail Roko' on October 18 to demand dismissal, arrest of Union Minister Ajay Mishra Demanding the arrest of Union Minister Ajay Mishra, Kisan Mazdoor Sangharsh Committee general secretary Sarwan Singh Pandher, on Monday, said the KMSC will hold protests at 20 places in 11 districts of the state. In a statement, the Samyukt Kisan Morcha (SKM), an umbrella body of farmer unions spearheading the agitation against the Centre's three agri laws, had said ""protests will be intensified until justice is secured"" in the Lakhimpur Kheri case. During the 'rail roko' protest, all train traffic will be stopped from 10 am till 4 pm on Monday, the SKM had said. ""To press for its demand for MoS Home Ajay Mishra's dismissal and arrest, so that justice can be secured in the Lakhimpur Kheri massacre, Samyukt Kisan Morcha has announced a nation-wide Rail Roko programme."" ALSO READ | Lakhimpur Kheri violence: Cong slams PM Modi for not removing Union minister despite son's arrest ""SKM put out a call to its constituents to stop rail traffic for six hours on October 18 between 10 am and 4 pm. The SKM asks for this action to be taken up peacefully, without any destruction and damage of any kind to any railway property,"" it had said. Four of the eight people who died in the violence on October 3 were farmers, allegedly knocked down by a vehicle carrying BJP workers. Angry farmers then allegedly lynched some people in the vehicles. The other dead included two BJP workers and their driver. Farmers have claimed that Ashish Mishra was in one of the vehicles, an allegation denied by him and Ajay Mishra who say they can produce evidence to prove he was at an event at that time. Ashish Mishra was arrested in the case on October 9.",newsexp,R,,,,,
