,headline,article_text,source,bias,cleaned_text,compound,positive,neutral,negative
18,Farmers Protest Highlights: Rail Roko Protest Called By Farmers' Body,"Farmers Protest on Lakhimpur Kheri Violence: Farmers' Body announced a nation-wide rail roko program.New Delhi: The Samyukta Kisan Morcha (SKM) called for a six-hour-long nationwide ''Rail roko'' agitation on Monday demanding the removal of Union Minister of State (MoS) for Home Affairs Ajay Mishra Teni from the Union Cabinet over the Lakhimpur Kheri incident, in which his son Ashish Mishra Teni is an accused.A statement issued by the umbrella body of farmers' unions read, ""To press for its demand for Ajay Mishra's dismissal and arrest, so that justice can be secured in Lakhimpur Kheri violence, SKM has announced a nation-wide rail roko program on October 18.""""SKM put out a call to its constituents to stop rail traffic for six hours on October 18, between 10 am and 4 pm. SKM asked for this action to be taken up peacefully, without any destruction and damage of any kind to any railway property,"" it further read.A total of eight people including four farmers died in the Lakhimpur Kheri violence. SKM had alleged Ashish Mishra shot a farmer while the others were run over by the vehicles of his convey.However, MoS Teni had refuted the allegations saying that his son was not present at the site of the incident. Ashish reiterated the same and refuted SKM's allegations.Later, three people, including Ashish Mishra, were arrested in the case.Here are Highlights on Rail Roko Protest:Oct 18, 2021 23:27 (IST)4 Including BJP Leader In SUV That Mowed Down Farmers In UP ArrestedFour more people, including a BJP leader who was seen inside the SUV that mowed down protesting farmers in Uttar Pradesh's Lakhimpur Kheri, have been arrested.Oct 18, 2021 22:01 (IST)Rail Roko agitation was successful, we will make further strategy: Rakesh TikaitBharatiya Kisan Union (BKU) spokesperson Rakesh Tikait called the Rail Roko protest called by the Samyukt Kisan Morcha (SKM) as successful. The protesting farmers are demanding dismissal and arrest of Union Minister of State Ajay Mishra.""Rail Roko agitation was fine. We will make our further strategy. Until Teni (MoS MHA Ajay Mishra Teni) is arrested and he resigns, we will continue putting forth our views. He is an accused under sections 120(B) of the Indian Penal Code (IPC). He cannot roam in the open,"" he said.Oct 18, 2021 18:02 (IST)Not received any report of disturbance: Delhi PoliceThe Delhi Police said there were no reports of any disturbance in the national capital due to Samyukt Kisan Morcha's six-hour ""rail roko"" protest to demand the dismissal and arrest of Union Minister Ajay Mishra in connection with the Lakhimpur Kheri incident. Deputy Commissioner of Police (Railways) Harendra Kumar Singh said, ""We have not received any report of disturbance in Delhi.""Oct 18, 2021 17:28 (IST)Rail roko agitation by farmers disrupts train services in OdishaTrain services were affected in the East Coast Railway division of Odisha for around 30 minutes to one hour owing to the ""rail roko"" agitation by farmers, demanding the dismissal and arrest of Union minister Ajay Mishra for his alleged involvement in the Lakhimpur Kheri violence earlier this month.The agitation call by Samyukt Kisan Morcha (SKM) - an umbrella union of the farmers -- received support from the Congress, the Left and the Aam Aadmi Party in Odisha.Oct 18, 2021 17:05 (IST)Meghalaya Governor offers to mediate on farmers' MSP demandBacking the protesting farmers on their demand for the dismissal of Union minister Ajay Mishra, Meghalaya Governor Satya Pal Malik said he should have resigned immediately after the Lakhimpur Kheri violence and does not deserve the post in any case.Mr Malik also said the BJP will not return to power unless the government listens to the farmers agitating over the agri laws, and asserted that he is ready to mediate if the Centre agrees to give legal guarantee on minimum support price (MSP) for crops.Oct 18, 2021 16:31 (IST)Centre has not spoken to us yet, says Rakesh TikaitAs the Samyukt Kisan Morcha (SKM) is staging a nationwide ""Rail Roko"" protest to demand the dismissal and arrest of Union Minister of State Ajay Mishra, Bharatiya Kisan Union spokesperson Rakesh Tikait said that the government has not spoken to them in this regard yet.Mr Tikait said, ""This protest is being staged in different districts across the country. The people of the country who support this movement know about the Rail Roko andolan. The Central Government has not spoken to us yet in this matter.""Oct 18, 2021 16:16 (IST)All India Kisan Sabha president calls Rail Roko Andolan ""successful""As the ""Rail Roko"" agitation is being staged by the farmers' unions to protest against the Lakhimpur Kheri violence case, the President of All India Kisan Sabha Ashok Dhawale has called the agitation ""successful"".Mr Dhawale said, ""The Rail Roko agitation is successful. It has been 15 days (i.e. from October 3-October 18) since the Lakhimpur Kheri incident took place. I demand Union Minister of State Ajay Mishra Teni to be removed from the post. It is shocking to know that, despite completing 75 years of Independence, the country witnessed such incident.""Oct 18, 2021 16:01 (IST)Four sections of Ferozepur division blocked by protestersFarmers in Punjab and elsewhere were seen squatting on rail tracks as part of their protest. Four sections of the Ferozepur division were blocked by the protesters, said a railway official. The Ferozepur-Fazilka section in Ferozepur city and the Ferozepur-Ludhiana section at Ajitwal in Moga were affected, he added.Oct 18, 2021 14:51 (IST)Passengers face problems as train movement is affected due to farmers union call for 'Rail Roko' agitation; visuals from Ludhiana Railway station.We've deployed sufficient force here to handle the law and order situation: Ludhiana Joint CP/City, Deepak PareekOct 18, 2021 14:00 (IST)Update| Around 50 trains, 130 locations affected due to farmers agitation in Punjab and Haryana: CPRO, Northern RailwayOct 18, 2021 13:49 (IST)Pressing for Union Minister Ajay Mishra's dismissal and arrest over the #LakhimpurKheriViolence case in #UttarPradesh, the farmers' body is holding a six-hour-long nationwide ''#RailRoko'' agitation.NDTV's Mohammed Ghazali reports from Mohali, Punjab. pic.twitter.com/ulZAyG3S0C- NDTV (@ndtv) October 18, 2021Oct 18, 2021 13:32 (IST) Government Railway Police is patrolling all railway stations and tracks. Till now ,there are no reports of disturbance at any railway tracks or cancellation of trains. We're working in close coordination with GRP of neighbouring states: Harendra Singh, DCP Railways on 'Rail Roko'.Oct 18, 2021 13:04 (IST)#FarmersProtest | #Farmers try to break through barricades at Hapur Railway Station in Western #UttarPradesh.Samyukt Kisan Morcha has called for a nationwide '#RailRokoAndolan' against the #LakhimpurKheri incdident. pic.twitter.com/4Vqntm5gNd- NDTV (@ndtv) October 18, 2021Oct 18, 2021 12:37 (IST)Update|  Passengers of a Chandigarh bound train say they are facing trouble as the train was terminated at Dappar station in Dera Bassi tehsil of SAS Nagar district, due to the ongoing 'Rail roko' agitation by farmers' unionOct 18, 2021 11:47 (IST)#LakhimpurKheriViolence | Farmers' Body's '#RailRoko' Protest OngoingLive updates: https://t.co/s5LoviEnYmNDTV's Mohammed Ghazali reports pic.twitter.com/CeGq4k9R3f- NDTV (@ndtv) October 18, 2021Oct 18, 2021 11:33 (IST)Update| As of now, 30 locations are affected and 8 trains regulated in Northern Railway Zone: CPRO, Northern Railway on 'Rail roko' agitationOct 18, 2021 11:20 (IST)#FarmersProtest | Protestors block railway tracks at Bahadurgarh in protest against the #LakhimpurKheri incident. #RailRokoAndolanpic.twitter.com/Tbm4EiSvUr- NDTV (@ndtv) October 18, 2021Oct 18, 2021 11:11 (IST)Farmers block train traffic in Punjab as part of ''rail roko'' stir over Lakhimpur incidentFarmers in Punjab squatted on rail tracks on Monday morning as part of the Samyukt Kisan Morcha's six-hour ''rail roko'' protest demanding the dismissal and arrest of Union Minister Ajay Mishra in connection with the violence in Uttar Pradesh''s Lakhimpur Kheri.A railway official said four sections of the Ferozepur division were blocked by the protesters. The Ferozepur-Fazilka section in Ferozepur city and the Ferozepur-Ludhiana section at Ajitwal in Moga were affected, the official said.Demanding the arrest of Union Minister Ajay Mishra, Kisan Mazdoor Sangharsh Committee general secretary Sarwan Singh Pandher on Monday demanded said the KMSC will hold protests at 20 places in 11 districts of the state.In a statement, the Samyukt Kisan Morcha (SKM), an umbrella body of farmer unions spearheading the agitation against the Centre's three agri laws, had said ""protests will be intensified until justice is secured"" in the Lakhimpur Kheri case.Oct 18, 2021 10:45 (IST)Update| Four sections of Northern railway have been blocked by farmers.Train services on Delhi to Rohtak and Delhi to Ambala routes have been stopped for now Oct 18, 2021 10:36 (IST)Protestors block railway tracks at Bahadurgarh in protest against Lakhimpur Kheri incident.Samyukta Kisan Morcha has called for nationwide 'Rail roko' in protest against the incident.Oct 18, 2021 10:05 (IST)Rapid Action Force deployed at Sonipat Railway Station, in the wake of 'Rail roko' call by Samyukta Kisan Morcha in protest against Lakhimpur Kheri incident.Oct 18, 2021 09:59 (IST)#RailRoko Today Seeks Minister's Resignation Over #UttarPradesh Farmers' Killing Read more: https://t.co/b9GUEIGdxTNDTV's Alok Pandey reports pic.twitter.com/rhYI6PyFez- NDTV (@ndtv) October 18, 2021Oct 18, 2021 09:48 (IST) Farm law protestors sit on the railway track at Devi Dasspura village in Amritsar following the farmer's union call for 'Rail Roko Andolan' todayOct 18, 2021 09:11 (IST)Update| Police to take action against those who will participate in the 'Rail Roko Andolan' called by farmers organization. 144 CrPC is also imposed in the district and will impose NSA if anyone tries to disrupt normalcy: Lucknow PoliceOct 18, 2021 08:43 (IST)Last week, Rahul Gandhi-led Congress delegation urged President Ram Nath Kovind to sack the minister whose son is accused of mowing down protesting farmers in UP. The President, in turn, has said he will speak to the government over the issue, said the Congress.The Congress, in its memorandum to the President, said dismissal of the Union Minister is pertinent for a fair probe in the matter, which they say is also the demand of the farmer families who lost their loved ones.Terming the Lakhimpur incident ""absolutely condemnable"", Finance Minister Nirmala Sitharaman has said issues of such nature happen in other parts of India equally which should be raised ""when they happen and not when it suits others"" because there is a BJP government in Uttar Pradesh.BJP MP Varun Gandhi - dumped from his party's National Executive this month after calling for justice for the families of farmers killed in Lakhimpur Kheri - tweeted an old video of former Prime Minister Atal Bihari Vajpayee warning the government against intimidating farmers.Oct 18, 2021 08:42 (IST)Rail Roko Today Seeks Minister's Resignation Over UP Farmers' KillingPressing for Union Minister Ajay Mishra's dismissal and arrest over Lakhimpur incident in Uttar Pradesh, in which his son has been arrested, the farmers' body has called for a six-hour long nationwide ''Rail roko'' agitation. Read moreOct 18, 2021 08:41 (IST)Pressing for Union Minister Ajay Mishra's dismissal and arrest over Lakhimpur incident in Uttar Pradesh, in which his son has been arrested, the farmers' body has called for a six-hour long nationwide ''Rail roko'' agitation.The Samyukta Kisan Morcha, an umbrella body of farmers' unions, said it will hold a peaceful nationwide rail roko protest from 10 am to 4 pm for justice in Lakhimpur Kheri violence in Uttar Pradesh.Union Minister of state for Home Ajay Mishra's son, Ashish, has been arrested in the case, but the farmers' body say that as long as the minister is in the government justice cannot be secured in the matter.Eight people, including four farmers, were killed in Lakhimpur when a car belonging to the minister ran over them on October 3. Farmers have alleged that the minister's son mowed down the protesting farmers.The minister had refuted the allegations saying that his son was not present at the site of the incident. His son has reiterated the same and denied the allegation.",ndtv,L,,,,,
19,Farmers' Body 'Rail <i>Roko</i>' Protest Today Over Farmers' Killing In UP,"Four of the eight people who died in the violence on October 3 were farmersNew Delhi: The Samyukt Kisan Morcha (SKM) on Sunday said 'Rail Roko' protests will be held across the country on October 18 to demand the dismissal and arrest Union Minister Ajay Mishra in connection with the Lakhimpur Kheri incident.In a statement, the umbrella body of farmer unions spearheading the farmers' agitation against the Centre's three agri laws, said ""protests will only be intensified until justice is secured"" in the Lakhimpur Kheri case.The SKM said during the 'rail roko' protest, all train traffic will be stopped for six hours from 10 am till 4 pm on Monday.""To press for its demand for MoS Home Ajay Mishra's dismissal and arrest, so that justice can be secured in the Lakhimpur Kheri massacre, Samyukt Kisan Morcha has announced a nation-wide Rail Roko program tomorrow.""SKM put out a call to its constituents to stop rail traffic for six hours on October 18, between 10 am and 4 pm. The SKM asks for this action to be taken up peacefully, without any destruction and damage of any kind to any railway property,"" it said.Four of the eight people who died in the violence on October 3 were farmers, allegedly knocked down by a vehicle carrying BJP workers. Angry farmers then allegedly lynched some people in the vehicles.The other dead included two BJP workers and their driver.Farmers have claimed that Ashish Mishra was in one of the vehicles, an allegation denied by him and Ajay Mishra who say they can produce evidence to prove he was at an event at that time.Ashish Mishra was arrested in the case on October 9.The SKM also claimed that at effigy-burning events across Uttar Pradesh, several farmer leaders were put under house arrested while some were detained.PromotedListen to the latest songs, only on JioSaavn.comSKM condemns this and asks the UP government not to suppress the right to protest of ordinary citizens, it added.(Except for the headline, this story has not been edited by NDTV staff and is published from a syndicated feed.)",ndtv,L,,,,,
20,"Organisational Polls, UP Violence To Be Top Agenda At Key Congress Meet","During meeting, party leadership is also likely to decide on schedule for electing new Congress chief.New Delhi: Organisational elections, forthcoming assembly polls and the current political situation, including the Lakhimpur Kheri incident, will be on top of the agenda as the top Congress brass gathers here on Saturday for a meeting of the party's working committee.The first physical meeting of the Congress' top decision-making body, Congress Working Committee (CWC), since the outbreak of the COVID-19 pandemic has been convened after demands from some quarters within the party to discuss important issues, including some defections in the recent past.The meeting also comes amid rumblings within the Congress'' state units such as in Punjab, Chhattisgarh and Rajasthan where the party is in power.The G-23 leaders have been demanding the convening of the CWC with Kapil Sibal last month wondering who in the party was taking decisions in the absence of a full-time president and asserting that G23 leaders'' grouping is ""not a Jee Huzur 23"".Former leader of the Opposition in the Rajya Sabha Ghulam Nabi Azad had also written to the Congress president to convene a meeting of the CWC soon.During the meeting, the party leadership is also likely to decide on the schedule for electing the new Congress chief.The party in its CWC meeting held on January 22 had decided that the Congress would have an elected president by June 2021, but the same was deferred at the May 10 CWC meet in the wake of the COVID-19 situation.The latest meeting is being held in the wake of the Lakhimpur Kheri clashes on October 3 in which eight people lost their lives, including four farmers who were allegedly run over by an SUV belonging to the convoy of Union Minister of State for Home Ajay Kumar Mishra.Minister of State for Home Mishra's son Ashish Mishra, who has been named in an FIR, was arrested on Saturday by the Uttar Pradesh Police in connection with the mowing down of the four farmers.The incident has given enough ammo to the Congress to corner the BJP government and recapture the lost political space.The meeting is likely to discuss key issues such as price rise, farmers' protests and the economic situation of the country.The CWC meeting will also discuss certain dissenting notes rising within the party over the spate of defections and the party's poor electoral fortunes.Congress chief ministers Ashok Gehlot (Rajasthan), Bhupesh Baghel (Chhattisgarh) and Charanjit Channi (Punjab) are expected to be present at the meeting.Sonia Gandhi took over as the interim Congress president in August 2019 after Rahul Gandhi resigned in the wake of the party's Lok Sabha debacle in May 2019.PromotedListen to the latest songs, only on JioSaavn.comThere have been demands from a section of Congress leaders for having a full-time and active party president as well as an organisational overhaul.The demand grew louder after a storm in the party in August last year over a letter to Sonia Gandhi by a group of 23 leaders, including Ghulam Nabi Azad, Anand Sharma, Bhupinder Hooda, Prithviraj Chavan, Kapil Sibal, Manish Tewari and Mukul Wasnik raising these issues.",ndtv,L,,,,,
21,Attention Diverted From Lakhimpur Kheri Incident By Aryan Khan Case: Kapil Sibal,"Kapil Sibal also took a dig at the Centre over India slipping to 101st position in hunger index (File)New Delhi: Senior Congress leader Kapil Sibal on Friday alleged that attention was diverted from the Lakhimpur Kheri incident through the Aryan Khan drug case.He also alleged that a ""guilty till proven innocent"" template was being applied in the case of Aryan Khan, son of Bollywood actor Shah Rukh Khan.Aryan (23), arrested by the Narcotics Control Bureau (NCB) on October 3, will have to remain in jail for some more days as a court on Thursday, after hearing arguments, posted the matter for orders on October 20.""Aryan Khan -- Narcotics Control Bureau investigation -- New Jurisprudence: No evidence of: consumption, possession. Guilty till proven innocent. Attention successfully diverted from Ashish Mishra (Lakhimpur Kheri),"" Mr Sibal tweeted.Aryan KhanNarcotics Control Bureau investigationNew Jurisprudence:No evidence of :consumptionpossessionGuilty till proven innocentAttention successfully diverted from Ashish 𝐌𝐢𝐬𝐡𝐫𝐚 ( Lakhimpur Kheri )— Kapil Sibal (@KapilSibal) October 15, 2021Stepping up pressure over the Lakhimpur incident, a Congress delegation led by Rahul Gandhi had met President Ram Nath Kovind on Wednesday and urged him to ensure the immediate sacking of Union Minister Ajay Mishra and an impartial judicial probe by two sitting judges of the Supreme Court.Ajay Mishra's son Ashish Mishra, who has been named in an FIR, was arrested on Saturday by the Uttar Pradesh Police in connection with the mowing down of four farmers on October 3 in Lakhimpur Kheri in Uttar Pradesh.In another tweet, Mr Sibal also took a dig at the government over India slipping to 101st position in the Global Hunger Index (GHI) 2021 of 116 countries, from its 2020 position of 94th.PromotedListen to the latest songs, only on JioSaavn.comCongratulations Modi ji for eradicating :1) poverty2) hunger3) making India a global power4) for our digital economy5) …………… so much moreGlobal Hunger Index :2020 : India ranked 942021 : India ranks 101Behind Bangladesh , Pakistan & Nepal— Kapil Sibal (@KapilSibal) October 15, 2021""Congratulations Modi ji for eradicating: 1) poverty 2) hunger 3) making India a global power 4) for our digital economy 5) …………… so much more. Global Hunger Index: 2020 : India ranked 94. 2021: India ranks 101,"" the Rajya Sabha MP tweeted.(Except for the headline, this story has not been edited by NDTV staff and is published from a syndicated feed.)",ndtv,L,,,,,
