,headline,article_text,source,bias,cleaned_text,compound,positive,neutral,negative
30,Will not let Assam become another Kashmir: Amit Shah on NRC,"In the light of the deadly terror attack on a CRPF convoy in Jammu and Kashmir, BJP chief Amit Shah while addressing a rally in Lakhimpur on Sunday raked up the issue of National Register of Citizens (NRC),  and said that the Centre “will not allow Assam to become another Kashmir”. “We will not allow Assam to become another Kashmir. That is why we have brought NRC (National Register of Citizens). We will deport each and every infiltrator with the help of NRC. We are committed to that,” he said. Promising that the sacrifices of the of the jawans would not go in vain, Shah firmly stated that the BJP-led NDA government is not ready to compromise on the security issue unlike its predecessor Congress. Calling it a ‘cowardly act’ by Pakistan-backed terrorists, Shah said that they would not be spared at any cost. “This cowardly act was done by Pakistani terrorists. Their (jawans’) sacrifices will not go in vain, because there is no Congress government at the Centre. It is BJP government and the Narendra Modi government will not compromise on any security issue,” he added. Bringing up the issue of the Assam Accord, the BJP chief slammed the opposition Congress and its former ally Asom Gana Parishad (AGP), saying that both the parties did nothing to implement the accord despite ruling most of the period since signing of the pact in 1985. Shah also touched upon the contentious Citizenship (Amendment) Bill, which the Centre failed to table in Rajya Sabha, saying misinformation was being spread about the bill. It was being made to appear as if it was only for Assam and other parts of the Northeast. “It was not only for Northeast, but for all refugees in the entire country. The way demography is changing in Assam, without the Citizenship Bill, the people of the state will be in big danger,” Shah said. 📣 The Indian Express is now on Telegram. Click here to join our channel (@indianexpress) and stay updated with the latest headlines For all the latest India News, download Indian Express App.     ",indianexpress,N,,,,,
31,"Priyanka Gandhi’s first acquisition: a ‘vote-cutter’, off-and-on Congress ally in Uttar Pradesh","ONE of the first major decisions of Priyanka Gandhi Vadra as Congress general secretary in-charge of eastern Uttar Pradesh was alliance with the Mahan Dal — a party that the Congress has kept turning to in the past few Lok Sabha polls in the state, despite its poor electoral performance. Since it was conceived in 2008, the party that claims influence among “non-Yadav” OBC voters in over a dozen Lok Sabha constituencies in western UP has not won a single Lok Sabha or Assembly seat. It has the capacity to play the spoiler though — a fact that the Congress, kept out of the SP-BSP alliance, seems to be banking on. The support of non-Yadav OBCs was believed to have been key to the BJP’s win in the 2014 Lok Sabha and 2017 Assembly polls in UP. The Mahan Dal was formed by Keshav Dev Maurya, who was earlier associated with the SP and BSP, and lost the 2004 Lok Sabha elections as an Apna Dal candidate from Jaunpur. In 2009, the Mahan Dal contested its first Lok Sabha polls, in tie-up with the Congress, fighting from Aonla and Mainpuri seats. In Aonla, it got 56,233 votes while the difference of votes between the winner BJP and the runner-up SP was just 7,861 votes. In SP bastion Manipuri though, the Mahan Dal had a dismal show, getting only 1,187 votes. In 2012, the Mahan Dal contested the Assembly elections alone, fielding candidates in 74 seats and getting 6.83 lakh or 0.90 per cent of the total votes polled in the state. In the 2014 Lok Sabha polls, the Congress again had an alliance with the Mahan Dal, along with the Rashtriya Lok Dal (RLD). While eight seats were given to the RLD, three seats were given to the Mahan Dal, including Etah, Nagina and Badaun. The party ended up getting about 22,774 votes on these west UP seats. In the 2017 Assembly polls, the Mahan Dal contested on 14 seats alone, getting 96,087 or 0.11 per cent of the total votes polled in the state. All its 14 candidates lost their deposits. The Congress fought in alliance with the SP. The party had contested on two seats in the recent Assembly polls in MP too, and was runner-up in Jatara and at fourth place in Jaura. Maurya’s son and the state president of the party’s youth wing, Kishan Maurya, said the party has support among non-Yadav OBCs such as Kushwahas, Shakyas, Sainis and Mauryas, in Amroha, Hathras, Aonla, Badaun, Etah, Bijnor, Bareilly and Lakhimpur seats. “The Mahan Dal could not win any seats but the Congress benefited from our alliance in 2009. The situation in 2014 was different,” said Kishan, hinting at the Modi wave. On the alliance for the coming Lok Sabha polls, he said, “We will accept whatever the Congress offers.” He said the alliance would also be on for the 2022 Assembly polls. Maurya added that it was the Mahan Dal’s support that had helped the SP win the Noorpur Assembly by-election last year. “Earlier our maximum impact was on the BSP. Later, most of these sections (the non-Yadav OBCs) came out in support of the BJP, so the Mahan Dal will now cause damage to the BJP.” About how it can damage any party, Maurya was candid. “If larger alliances like the BJP’s or SP-BSP’s take us in, we are strong. Otherwise we cut votes… If we can’t cut votes, who will give us a share?” 📣 The Indian Express is now on Telegram. Click here to join our channel (@indianexpress) and stay updated with the latest headlines For all the latest Elections News, download Indian Express App.      
Lalmani Verma... read more",indianexpress,N,,,,,
32,How the Assamese are saving orchids through social media and cultivation,"In January 2003, two days before Bohag Bihu, Khyanjeet Gogoi, trekking in the forests bordering Dibru Saikhowa National Park, was picked up by the United Liberated Front of Assam (ULFA) — at the time the most dreaded militant outfit of the Northeast. Held hostage in a secret “jungle” camp on the Assam-Arunachal Pradesh border, the militants interrogated Khyanjeet: “Why are you here? What are you looking for?” “Orchids,” the 23-year-old replied. It was an answer no one expected. Three days later, the slightly bemused ULFA cadres left Khyanjeet on the banks of a river; he was free to make his way home. He was looking for a rare species of orchid at the park. Needless to say, those orchids were never found, but the quest continued. Since 1994, he has been travelling only in search of orchids. Over the years, he has recorded 395 species in Assam alone, discovered 35 new ones, named three himself and cultivated several more in his backyard in the small town of Rupai in Upper Assam’s Doomdooma, where he teaches biology at a local high school. Today, he has many monikers in Assam: the orchid expert, the orchid whisperer, the orchid man, and is often called by the government to identify rare species. In Assam, the kopou phool, or the foxtail orchid, the pinkish-white flower that blooms in April and resembles a fox’s tail, was accorded the status of state flower in 2003. It has been, since time immemorial, linked to Assamese culture (as a symbol of fertility, merriment, love and affection) and is most conspicuous during Magh Bihu (the festival that heralds spring in Assam) — not just on trees, but also neatly tied to the head of a Bihu dancer. “For the longest time, I didn’t even know they were called orchids. As a child, I would recognise them as kopou phool,” says Khyanjeet, who first saw these flowers not adorning a Bihu dancer’s head, but lying by the side of the road. “After using them, people would just throw these flowers away, and I — attracted by their appearance — would often collect them,” he says. He remembers, how as a student of botany in Sivasagar, he found no books on the subject in his college library, save for one chapter in one text book. “That is when I decided I should write to a book on orchids in Assam,” he recalls. In 2010, he published the Wild Orchids of Assam. To date, it’s arguably the only full-length book in English on Assam orchids. In India, there are 1331 species of orchids, found in the Eastern Himalayas including Northeast region, Western Ghats, and eastern part of western Himalayas. “But the Northeast remains an orchid hotspot (all the seven states) with 72 per cent of total orchids found in India,” says Khyanjeet. However, simultaneously, as these flowers bloom, they are fast wilting and disappearing too. The reasons are many: deforestation, soil erosion, over grazing. While some traders do have proper trade licenses, majority of orchid trade, which is in part with China, is illegal. In 2015, Assam inaugurated the three-hectare Kaziranga National Orchid and Biodiversity Park belonging to Akhil Gogoi’s Krishak Mukti Sangram Samiti, which was promoted as a space for conservation. Today, it has 500 varieties of wild orchids, and is a tourist attraction. A life member of Orchid Society of India, and the founder member of the Orchid Society of Eastern Himalayas, Khyanjeet met 26-year-old Ankur Gogoi at a youth festival in 2015. A dhul player of a local Bihu band in his hometown at Tengapukhuri, Ankur recounts, “Right before one of our performances, we realised we didn’t have any orchids for the girl dancers to put in their hair. But luckily, we came across someone who was cultivating close to 100 orchids in their home.” That made him think — “If they can, why can’t I? In 2010, I started getting orchids home — with the little knowledge I had, I began growing them. I would tie them up to the big mango and betel nut trees in my yard with a string. Soon I had twenty varieties.” Khyanjeet taught Ankur how to culture the flowers, how to propagate them, and make more seedlings. For example, it wasn’t enough to just “bring orchids home”. “Orchids thrive only in certain climate — yes, they are easy to cultivate, but they are as easy to kill too,” Ankur was told. Through social media, in 2017, Ankur connected to other orchid lovers in Assam, from Dhemaji, Lakhimpur, Golaghat, and Tinsukia. “These were teachers, businessmen, students, tea planters,” says Ankur. A social app called the ‘Orchid Group of Assam’ now has 53 members. They formed The Orchid Society of Assam, now a formally registered society, with the singular aim of conservation of orchid species in the state. “The kopou phool is the state flower. If we can protect the rhino, our state animal, why can’t we protect the kopou phool too?” says Mithu Gogi, a tea planter who is a member of the group and has about 7,000 kopou phools growing in his backyard. “But it is an expensive proposition,” he admits. There are no government funds for its conservation. “We spend our own money only because we love it,” says Ankur. 📣 The Indian Express is now on Telegram. Click here to join our channel (@indianexpress) and stay updated with the latest headlines For all the latest Lifestyle News, download Indian Express App.      
Tora AgarwalaTora covers the Northeast for <em>The Indian Express. </em>Follow her... read more",indianexpress,N,,,,,
33,War of the Orchids: how a few Assamese are battling to save a flower through social media and paper documents,"In January 2003, two days before Bihu, Khyanjeet Gogoi, trekking in the forests bordering Dibru Saikhowa National Park, was picked up by the United Liberation Front of Assam (ULFA) — at the time the most dreaded militant outfit of the Northeast. Held hostage in a secret “jungle” camp on the Assam-Arunachal Pradesh border, the militants interrogated Khyanjeet: “Why are you here? What are you looking for?” “Orchids,” the 23-year-old replied. It was an answer no one expected. Three days later, the slightly bemused ULFA cadres left Khyanjeet on the banks of a river; he was free to make his way home. That trip, remembers Khyanjeet, was futile. “I was looking for a rare species of orchid that was apparently growing wild at the national park.” Needless to say, those orchids were never discovered, but the quest continued. For Khyanjeet, ever since 1994, has been travelling only in search of orchids. Over the years, he has recorded 395 species in Assam alone, discovered 35 new ones, named three himself and cultivated several more in his backyard in the small town of Rupai in Upper Assam’s Doomdooma, where he teaches Biology at a local high school. Today, the 38-year-old has many monikers in Assam: the orchid expert, the orchid whisperer, the orchid man, and is often called by the government to identify rare species. “If my friends invite me for a holiday, the first question I ask is: is there a forest near by?” says Khyanjeet, over the phone from Rupai, “Because, if there are forests, then there are definitely orchids.” A THRIVING ILLEGAL TRADE In Assam, the kopou phool, or the foxtail orchid, the mauve-ish flower that blooms in April and resembles a fox’s tail, was accorded the status of state flower in 2003. It has been, since time immemorial, linked to Assamese culture (as a symbol of fertility, merriment, love and affection) and is most conspicuous during Bohag Bihu (the festival that heralds spring in Assam) — not just on trees, but also neatly adoring the head of a Bihu dancer. “For the longest time, I didn’t even know they were called orchids. As a child, I would recognise them as kopou phool,” says Khyanjeet, who first saw these flowers not on a Bihu dancer’s head, but lying by the side of the road. “After using them, people would just throw these flowers away, and I — attracted by their appearance — would often collect them,” he says. Later, as a student of Botany, he learned that the kopou phool was just one kind of orchid, and in the thickly-forested areas of Assam alone, there were many, many more, growing wild. In India, there are 1,331 species of orchids, found in the Eastern Himalayas including the Northeast, Western Ghats, and the eastern part of Western Himalayas. “But the Northeast remains an orchid hotspot with 72% of total orchids found in India,” says Khyanjeet. In Assam, orchids are found in the tropical wet forests of Lakhimpur, Tinsukia, Dibrugarh, Dhemaji, Kokrajhar and Karbi Anglong. However, simultaneously, as these flowers bloom, they are wilting and disappearing too. The reasons are many: deforestation, soil erosion, over grazing — “But also, a thriving illegal trade,” adds Khyanjeet. While some traders do have proper trade licenses, majority of orchid trade, which is in part with China, is illegal. In 2015, Assam inaugurated the three-hectare Kaziranga National Orchid and Biodiversity Park belonging to peasant activist Akhil Gogoi’s Krishak Mukti Sangram Samiti, which was promoted as a space for conservation. Today, it is a tourist attraction, and has 500 varieties of wild orchids. Yet, despite these efforts, there are several species (like the Blue Vanda, or the Vanda coerulea that resembles a lady’s tresses, or the beautiful Paphiopedilum hirsutissimum popularly known as the Lady’s Slipper) that would thrive in Assam at one point but are no longer found. Khyanjeet, who helped setting up the biodiversity park at Kaziranga, and later moved away, feels that orchid conservation needs stronger laws in place. “The Wildlife Protection Act states that no one can trade anything (](living / dead plants or animals) from the forest— but when it comes to orchids, no one pays heed to that,” says Khyanjeet. While the illegal trade with China is not a secret, no one has really investigated it. “I suppose one could but one needs to find people who are interested in orchids too,” he says. It was only last month that he did. THE ORCHID WHATSAPP GROUP OF ASSAM For the longest time, Khyanjeet, who “stays away from social media”, wanted to form a society with like-minded orchid lovers from Assam. He was already a life member of Orchid Society of India, and the founder member of the Orchid Society of Eastern Himalayas — “But we never had a dedicated society in Assam,” he says. In 2015, at a youth festival in Sivasagar, he met 26-year-old Ankur Gogoi, who claims he found his life’s calling when he least expected to — as a dhul player of a local Bihu band in his hometown at Tengapukhuri in 2010.  “Right before our performance, we realised we didn’t have any orchids for the girls to put in their hair. But luckily, we came across someone who was cultivating close to 100 orchids in their home.” That made Ankur think — “If they can, why can’t I? In 2010, I started getting orchids home and began growing them.” Orchids can grow on the ground, on rocks and even on other trees and plants. “I would tie them up to the big mango and betel nut trees in my yard with a string. Soon I had twenty varieties.” It was only when he met Khyanjeet, who Ankur considers his mentor, that the latter feels he truly learned about orchids. “He taught me a lot: how to culture them, how to propagate them, how to make more seedlings,” Ankur recalls. For example, it wasn’t enough to just “bring orchids home”. “Orchids thrive only in certain climate — yes, they are easy to cultivate, but they are as easy to kill too,” Khyanjeet had told Ankur, who would post tidbits of information from these lessons, along with beautiful pictures on Facebook. “I started sharing these tips on social media in the hope to find other people who liked orchids,” says Ankur. Turns out many did. Through Facebook, beginning late 2017, Ankur connected to other orchid lovers in Assam — enthusiasts from Dhemaji, Lakhimpur, Golaghat, and Tinsukia. “These were  teachers, businessmen, students, tea planters — both men and women, young and old — who wanted to learn more about the orchid simply because they liked it,” says Ankur. Soon, a Whatsapp group was formed. “I called it the ‘Orchid Group of Assam’, and it now has 53 members.”  Khyanjeet, who doesn’t own a smartphone, is not on it. AN EXPENSIVE PROPOSITION On December 29, 2018, three days before the year ended, and almost 12 months after they connected on Facebook, the orchid lovers met for the first time at the Silapathar Science College in Dhemaji. “It was Khyanjeet da’s idea. He said that since we were already talking on Whatsapp, why not do it face to face,” says Ankur. The Orchid Society of Assam is now a formally registered society with the singular aim of conservation of orchid species in the state. While Ankur is the Secretary, Dr Jitu Gogoi, who teaches Botany at the Silapathar Science College is President. And then there are members like Mithu Gogoi a tea planter, who, in his backyard in Jorhat, has about 7,000 kopou phools growing, since 2013. It isn’t a commercial venture but a hobby he indulges in with sound reason. “The kopou phool is the state flower. If we can protect the rhino, our state animal, why can’t we protect the kopou phool too?” Mithu asks. The society, now one month old, effectively wants to create awareness about the flower: to teach people its value, its worth, and how to take care of it. “You might buy it, but if you don know how to culture it in proper labs,  then there is no point,” says Ankur. He now has 350 species growing at his home in Tengapukhuri. “But it is an expensive proposition,” he admits. There are no government funds for its conservation and even the few books available on orchids are expensive. “We do it spending our own money only because we love it,” says Ankur. As does Khyanjeet. He remembers, how as a student of Botany in Sivasagar, he found no books on the subject in his college library, save for one chapter in one text book. “That is when I decided I should write a book on orchids in Assam,” he recalls. In 2010, he published the Wild Orchids of Assam, based on his years of research. It is arguably the only full-length book in English on orchids in Assam. 📣 The Indian Express is now on Telegram. Click here to join our channel (@indianexpress) and stay updated with the latest headlines For all the latest North East India News, download Indian Express App.      
Tora AgarwalaTora covers the Northeast for <em>The Indian Express. </em>Follow her... read more",indianexpress,N,,,,,
34,"Lakhimpur Kheri: Girls found dead were strangulated, say police","Two minor girls, who were found dead at Jheera Bojhi village in Lakhimpur Kheri on Friday evening, were strangulated to death, police said. Autopsy report confirmed that they were killed, but ruled out any sexual assault or rape, police added. “Though the families claimed that they found the bodies hanging from an electricity pole in a field, we do not have any evidence to prove that. The investigation is on,” Additional Superintendent of Police, Lakhimpur Kheri, Ghanshyam, said. By the time the police reached the spot, they found the bodies lying on the field, he added. “The postmortem was conducted by a panel of three doctors and its report stated that the death occurred due to strangulation. No injury marks have been found on the bodies. They have also ruled out any sexual assault. A murder case has been lodged against unidentified people on the complaint of the girls’ families,” said Ghanshyam. Police said that they are also not ruling out honour killing angle. “We have come to know that the girls used to go to the field everyday to graze their cattle and return home in the evening. On Friday, they had left home at around 2 pm. No other family members were with them. Around 5.00 pm, when the girls did not return, their families started looking for them,” the ASP said. “The families claim that they spotted the girls hanging from the electricity pole in the field in the evening. They brought down the bodies and informed the police. We have come to know that the locals had last spotted the girls in the field at around 4.00 pm,” Ghanshyam added. The field where the bodies were found is located around 500 metre from the houses of the victims. “The victims’ slippers were found lying a few distance away from the electricity pole though there is no sign of scuffle at the spot. So far, the victims’ family denied having any enmity with any person,” said Pasgwan station house officer, Satendra Singh. 📣 The Indian Express is now on Telegram. Click here to join our channel (@indianexpress) and stay updated with the latest headlines For all the latest Lucknow News, download Indian Express App.     ",indianexpress,N,,,,,
35,Kin of those killed in Assam movement return mementos,"In a symbolic protest against the Citizenship (Amendment) Bill, the families of 76 people killed during the Assam Movement in the 1980s on Wednesday returned mementos awarded to them by Chief Minister Sarbananda Sonowal in 2016. The families gathered at the office of All Assam Students’ Union (AASU) — which had spearheaded the six-year movement — and then marched to the DC office in Guwahati to return the mementos. The Assam Movement started in 1979 against illegal immigrants in the state. The six-year agitation concluded with the signing of the Assam Accord in 1985, which stated that all those who came from Bangladesh after March 24, 1971, have to be deported, irrespective of their religion. In December 2016, Sonowal had disbursed one-time ex-gratia of Rs 5 Lakh and a memento to the kin of each of the 855 people killed during the movement. The families did not return the monetary reward. Rajen Deka, the president of an association representing the families, told The Indian Express, “The memento is the main thing. We are returning it in protest against the Bill. The Bill will destroy the people of Assam and rob us of our dignity in our own land. It will protect illegal foreigners.” The Bill amends the Citizenship Act, 1955, by relaxing the eligibility rules for a section of immigrants — belonging to six minority (non-Muslim) religions, Hindus, Sikhs, Buddhists, Jains, Parsis and Christians, from Afghanistan, Bangladesh or Pakistan — in getting Indian citizenship. Opposition parties and several outfits have claimed that the Bill is a “threat” to the indigenous communities of the region and that it violates the Assam Accord. Rita Barua, sister of Lusan Barua, who was killed during the movement, said, “We are returning the award because the Sonowal-led Assam government has not kept its promise to making Assam free of illegal foreigners. It is a shame how the sacrifice of the martyrs is being insulted.” Bhubon Bora, a relative of K Deka, who was killed during the movement, said, “Around 855 people were martyred to save Assam from illegal foreigners. But if the Bill is passed, then the movement’s efforts and the Assam Accord will be nullified. What is the use of the keeping the memento from this government if they are bringing in a Bill which is against the Assam Accord?” Dipti Bora of Morigaon district, who lost her elder brother during the movement, said, “This Bill protects the foreigners by violating the Assam Accord. We protest against this Bill.” Sidheswar Pator of Morigaon and Krishna Borpatragohain from Lakhimpur, who lost relatives in the movement, echoed the same sentiments. “This Bill will be very bad for Assam. Illegal foreigners will be legalised through this Bill,” Pator said. 📣 The Indian Express is now on Telegram. Click here to join our channel (@indianexpress) and stay updated with the latest headlines For all the latest North East India News, download Indian Express App.      
Abhishek Saha... read more",indianexpress,N,,,,,
